Pro Filt’r Soft Matte Longwear Liquid Foundation	Sephora	251	228	187	https://www.sephora.com/product/pro-filtr-soft-matte-longwear-foundation-P87985432?skuId=2484293	Fenty Beauty by Rihanna	410	15.0
Dior Forever Skin Glow Foundation SPF 15	Sephora	242	218	184	https://www.sephora.com/product/forever-glow-foundation-P439941	Dior	5W Warm	55.0
Teint Idole Ultra Wear 5-In-1 Foundation Stick	Sephora	242	221	204	https://www.sephora.com/product/lancome-teint-idole-ultra-wear-5-in-1-foundation-stick-P468688?skuId=2423085	Lancôme	350 Bisque Cool	24.5
Flex Foundation Stick	Sephora	251	216	188	https://www.sephora.com/product/flex-foundation-stick-P448151?skuId=2242139	MILK MAKEUP	Medium Tan	36.0
SEA Hydroflex™ Serum Foundation	Sephora	249	222	211	https://www.sephora.com/product/tarte-sea-hydroflex-trade-serum-foundation-P473000?skuId=2453777	tarte	39H medium	19.0
Luminous Silk Perfect Glow Flawless Oil-Free Foundation	Sephora	233	202	173	https://www.sephora.com/product/luminous-silk-foundation-P393401	Armani Beauty	7.5	69.0
Turn Up the Base Blurring Foundation	Sephora	247	224	210	https://www.sephora.com/product/turn-up-base-beauty-blur-balm-foundation-P478536?skuId=2548097	ONE/SIZE by Patrick Starrr	Deep 1	35.0
Teint Idole Ultra Wear Care & Glow Foundation with Hyaluronic Acid	Sephora	132	91	73	https://www.sephora.com/product/teint-idole-ultra-wear-care-glow-foundation-P500706?skuId=2589034	Lancôme	405W	57.0
BB blur tinted moisturizer Broad Spectrum SPF 30 Sunscreen	Sephora	239	206	187	https://www.sephora.com/product/bb-tinted-treatment-12-hour-primer-broad-spectrum-spf-30-sunscreen-P377542?skuId=2413011	tarte	Tan	40.0
Pro Filt’r Soft Matte Longwear Powder Foundation	Sephora	250	230	223	https://www.sephora.com/product/fenty-beauty-rihanna-pro-filt-r-soft-matte-powder-foundation-P466829?skuId=2413656	Fenty Beauty by Rihanna	350	40.0
Dior Forever Skin Glow Foundation SPF 15	Sephora	242	218	184	https://www.sephora.com/product/forever-glow-foundation-P439941	Dior	5W Warm	55.0
GloWish Multidew Vegan Skin Tint Foundation	Sephora	253	225	213	https://www.sephora.com/product/huda-beauty-glowish-multidew-vegan-skin-tint-foundation-P472815?skuId=2465359	HUDA BEAUTY	09 Extra Tan	37.0
Traceless Soft Matte Foundation	Sephora	107	68	51	https://www.sephora.com/product/tom-ford-traceless-soft-matte-foundation-P459506?skuId=2367191	TOM FORD	8.2 Warm Honey	90.0
Slip Tint Dewy Tinted Moisturizer SPF 35 Sunscreen	Sephora	240	194	178	https://www.sephora.com/product/saie-slip-tint-dewy-tinted-moisturizer-spf-35-sunscreen-P468210?skuId=2413946	Saie	Three	36.0
Mini HD Skin Undetectable Longwear Foundation	Sephora	230	176	138	https://www.sephora.com/product/mini-hd-skin-undetectable-longwear-foundation-P500323?skuId=2513844	MAKE UP FOR EVER	1N06 Porcelain	22.0
Pro Filt’r Soft Matte Longwear Liquid Foundation	Sephora	251	228	187	https://www.sephora.com/product/pro-filtr-soft-matte-longwear-foundation-P87985432?skuId=2483915	Fenty Beauty by Rihanna	100	15.0
Amazonian Clay 16-Hour Full Coverage Foundation	Sephora	239	221	199	https://www.sephora.com/product/tarte-amazonian-clay-16-hour-full-coverage-foundation-P473821?skuId=2475986	tarte	44G Tan Golden	40.0
Skin Long-Wear Weightless Foundation SPF 15	Sephora	233	193	167	https://www.sephora.com/product/skin-long-wear-weightless-foundation-spf-15-P427430?skuId=2032803	Bobbi Brown	Porcelain (N	52.0
Revealer Skin-Improving Foundation SPF 25 with Hyaluronic Acid and Niacinamide	Sephora	234	206	182	https://www.sephora.com/product/kosas-revealer-skin-improving-foundation-spf25-with-hyaluronic-acid-niacinamide-P481396?skuId=2512192	Kosas	Medium Deep Neutral 320	42.0
Triclone Skin Tech Medium Coverage Foundation with Fermented Arnica	Sephora	56	28	6	https://www.sephora.com/product/triclone-skin-tech-medium-coverage-foundation-with-fermented-arnica-P502185?skuId=2597441	HAUS LABS BY LADY GAGA	100 Light Neutral	45.0
Light Reflecting Advanced Skincare Foundation	Sephora	248	227	196	https://www.sephora.com/product/nars-light-reflecting-advance-skincare-foundation-P479338?skuId=2514735	NARS	Oslo	50.0
Sheer Glow Foundation	Sephora	175	133	111	https://www.sephora.com/product/sheer-glow-foundation-P247355?skuId=2170611	NARS	Copenhagen	47.0
Moisture Surge CC Cream Hydrating Colour Corrector Broad Spectrum SPF 30	Sephora	204	158	135	https://www.sephora.com/product/moisture-surge-cc-cream-hydrating-colour-corrector-broad-spectrum-spf-30-P378639?skuId=1509504	CLINIQUE	Light	42.0
Turn Up The Base Versatile Powder Foundation	Sephora	97	78	61	https://www.sephora.com/product/one-size-by-patrick-starrr-turn-up-base-versatile-powder-foundation-P469953?skuId=2426856	ONE/SIZE by Patrick Starrr	Light 2 (N)	38.0
CC+ Cream Full Coverage Color Correcting Foundation with SPF 50+	Sephora	255	242	234	https://www.sephora.com/product/your-skin-but-better-cc-cream-spf-50-P411885?skuId=2606044	IT Cosmetics	Rich	17.0
Hello Happy Velvet Powder Foundation	Sephora	253	190	149	https://www.sephora.com/product/hello-happy-velvet-power-foundation-P447122?skuId=2254258	Benefit Cosmetics	2	30.0
Sublime Perfection Foundation	Sephora	255	237	225	https://www.sephora.com/product/skin-fetish-sublime-perfection-foundation-P447519?skuId=2257095	PAT McGRATH LABS	Medium Deep 23	68.0
Good Apple Lightweight Full-Coverage Cream Foundation Balm	Sephora	209	181	159	https://www.sephora.com/product/kvd-vegan-beauty-good-apple-skin-perfecting-foundation-balm-P469488?skuId=2420024	KVD Beauty	Medium 042	42.5
Flawless Lumière Radiance-Perfecting Foundation	Sephora	194	162	141	https://www.sephora.com/product/flawless-lumiere-radiance-perfecting-foundation-P440268?skuId=2181618	Laura Mercier	2W1.5 Bisque	49.0
GloWish Multidew Vegan Skin Tint Foundation	Sephora	253	225	213	https://www.sephora.com/product/huda-beauty-glowish-multidew-vegan-skin-tint-foundation-P472815?skuId=2465441	HUDA BEAUTY	12 Rich	37.0
Revealer Skin-Improving Foundation SPF 25 with Hyaluronic Acid and Niacinamide	Sephora	234	206	182	https://www.sephora.com/product/kosas-revealer-skin-improving-foundation-spf25-with-hyaluronic-acid-niacinamide-P481396?skuId=2512101	Kosas	Deep Neutral Warm 410	42.0
Tinted Moisturizer Oil Free Natural Skin Perfector Broad Spectrum SPF 20	Sephora	255	206	174	https://www.sephora.com/product/tinted-moisturizer-broad-spectrum-oil-free-P140906?skuId=2449387	Laura Mercier	6C1 Cacao	53.0
Triclone Skin Tech Medium Coverage Foundation with Fermented Arnica	Sephora	56	28	6	https://www.sephora.com/product/triclone-skin-tech-medium-coverage-foundation-with-fermented-arnica-P502185?skuId=2597037	HAUS LABS BY LADY GAGA	570 Deep Cool	45.0
Tinted Cover Skin Tint Foundation	Sephora	244	187	160	https://www.sephora.com/product/nudies-tinted-cover-foundation-P448152?skuId=2661569	NUDESTIX	NUDE 7.5	36.0
Double Wear Sheer Long-Wear Makeup SPF 19	Sephora	200	164	138	https://www.sephora.com/product/estee-lauder-double-wear-sheer-long-wear-makeup-spf-19-P475536?skuId=2479384	Estée Lauder	4W1 Honey Bronze	48.0
Luminous Silk Perfect Glow Flawless Oil-Free Foundation	Sephora	233	202	173	https://www.sephora.com/product/luminous-silk-foundation-P393401	Armani Beauty	7.5	69.0
Mini Pro Filt'r Soft Matte Foundation	Sephora	255	217	181	https://www.sephora.com/product/fenty-beauty-rihanna-mini-pro-filtr-soft-matte-foundation-P476525	Fenty Beauty by Rihanna	410	15.0
Yummy Skin Serum Foundation Refill	Sephora	255	231	207	https://www.sephora.com/product/danessa-myricks-beauty-yummy-skin-serum-foundation-refill-P481695?skuId=2575843	Danessa Myricks Beauty	19G	24.0
Light Reflecting Advanced Skincare Foundation	Sephora	248	227	196	https://www.sephora.com/product/nars-light-reflecting-advance-skincare-foundation-P479338?skuId=2514487	NARS	Macao	50.0
Eaze Drop Blurring Skin Tint	Sephora	250	226	214	https://www.sephora.com/product/fenty-beauty-rihanna-eaze-drop-blurring-skin-tint-P470025?skuId=2431922	Fenty Beauty by Rihanna	20	35.0
Beyond Perfecting Foundation + Concealer	Sephora	246	233	217	https://www.sephora.com/product/beyond-perfecting-foundation-concealer-P393325?skuId=1674571	CLINIQUE	CN 40 Cream Chamois	37.0
10 Hour Wear Perfection Foundation	Sephora	115	81	79	https://www.sephora.com/product/10-hr-wear-perfection-foundation-P379509?skuId=2222156	SEPHORA COLLECTION	11.5 Pink Ecru	20.0
Very Valentino 24 Hour Long Wear Liquid Foundation	Sephora	229	193	157	https://www.sephora.com/product/valentino-very-valentino-24-hour-wear-liquid-foundation-P479509	Valentino	LIGR2	60.0
All Hours Luminous Matte Foundation 24H Longwear SPF 30 with Hyaluronic Acid	Sephora	134	79	40	https://www.sephora.com/product/all-hours-full-coverage-matte-foundation-P421456?skuId=2598415	Yves Saint Laurent	LC1	60.0
Ambient Soft Glow Foundation	Sephora	224	206	192	https://www.sephora.com/product/ambient-soft-glow-foundation-P501154?skuId=2587053	Hourglass	16.5	58.0
Skin Foundation Stick	Sephora	231	201	175	https://www.sephora.com/product/foundation-stick-P270549?skuId=1587443	Bobbi Brown	Warm Almond (W	52.0
Bounce™ Liquid Whip Long Wear Foundation	Sephora	254	232	209	https://www.sephora.com/product/bounce-liquid-whip-longwear-foundation-P433987?skuId=2570752	beautyblender	4.40N Deep Neutral	29.0
Beyond Perfecting Foundation + Concealer	Sephora	246	233	217	https://www.sephora.com/product/beyond-perfecting-foundation-concealer-P393325?skuId=1744697	CLINIQUE	CN 02 Breeze	37.0
BACKSTAGE Face & Body Foundation	Sephora	231	218	201	https://www.sephora.com/product/backstage-face-body-foundation-P432500?skuId=2070456	Dior	2 Cool Rosy	40.0
Mini Pro Filt'r Soft Matte Foundation	Sephora	255	217	181	https://www.sephora.com/product/fenty-beauty-rihanna-mini-pro-filtr-soft-matte-foundation-P476525	Fenty Beauty by Rihanna	410	15.0
Liquid Touch Weightless Foundation	Sephora	247	223	197	https://www.sephora.com/product/rare-beauty-by-selena-gomez-liquid-touch-weightless-foundation-P49848448	Rare Beauty by Selena Gomez	360W	30.0
SkinFlex Stick Foundation	Sephora	196	166	140	https://www.sephora.com/product/fashion-fair-skinflex-stick-foundation-P476556?skuId=2476588	Fashion Fair	Honey Child	39.0
Tinted Moisturizer Oil Free Natural Skin Perfector Broad Spectrum SPF 20	Sephora	255	206	174	https://www.sephora.com/product/tinted-moisturizer-broad-spectrum-oil-free-P140906?skuId=2449437	Laura Mercier	5C1 Nutmeg	53.0
Crème to Powder Skin Foundation	Sephora	168	123	84	https://www.sephora.com/product/fashion-fair-creme-to-powder-skin-foundation-P476444?skuId=2476778	Fashion Fair	Blessed Bronze	39.0
Super Smoother Blurring Skin Tint	Sephora	234	199	179	https://www.sephora.com/product/iconic-london-super-smoother-blurring-skin-tint-P502623?skuId=2609048	Iconic London	Neutral Rich	32.0
Very Valentino 24 Hour Long Wear Liquid Foundation	Sephora	229	193	157	https://www.sephora.com/product/valentino-very-valentino-24-hour-wear-liquid-foundation-P479509	Valentino	LIGR2	60.0
Dior Forever Skin Glow Foundation SPF 15	Sephora	242	218	184	https://www.sephora.com/product/forever-glow-foundation-P439941	Dior	5W Warm	55.0
Mini Tinted Moisturizer Oil Free Natural Skin Perfector Broad Spectrum SPF 20	Sephora	255	206	174	https://www.sephora.com/product/laura-mercier-mini-tinted-moisturizer-broad-spectrum-spf-20-oil-free-P466665?skuId=2454536	Laura Mercier	5W1 Tan	29.0
Beautiful Skin Medium Coverage Liquid Foundation with Hyaluronic Acid	Sephora	242	220	199	https://www.sephora.com/product/charlotte-tilbury-beautiful-skin-medium-coverage-liquid-foundation-with-hyaluronic-acid-P480286?skuId=2551802	Charlotte Tilbury	3 Cool	49.0
Pro Filt’r Soft Matte Longwear Liquid Foundation	Sephora	251	228	187	https://www.sephora.com/product/pro-filtr-soft-matte-longwear-foundation-P87985432?skuId=2484152	Fenty Beauty by Rihanna	290	15.0
Mini Luminous Silk Perfect Glow Flawless Oil-Free Foundation	Sephora	218	166	129	https://www.sephora.com/product/luminous-silk-foundation-mini-P425938?skuId=1803279	Armani Beauty	5.75	45.0
Pro Filt’r Soft Matte Longwear Liquid Foundation	Sephora	251	228	187	https://www.sephora.com/product/pro-filtr-soft-matte-longwear-foundation-P87985432?skuId=2484178	Fenty Beauty by Rihanna	310	15.0
Major Skin Crème Foundation and Finishing Powder Duo	Sephora	247	240	232	https://www.sephora.com/product/major-skin-creme-powder-foundation-duo-P502039?skuId=2607406	PATRICK TA	Tan 1	52.0
All Hours Luminous Matte Foundation 24H Longwear SPF 30 with Hyaluronic Acid	Sephora	134	79	40	https://www.sephora.com/product/all-hours-full-coverage-matte-foundation-P421456?skuId=2598282	Yves Saint Laurent	LW8	60.0
Luminous Silk Perfect Glow Flawless Oil-Free Foundation	Sephora	233	202	173	https://www.sephora.com/product/luminous-silk-foundation-P393401	Armani Beauty	7.5	69.0
Mini Amazonian Clay 16-Hour Full Coverage Foundation	Sephora	238	222	207	https://www.sephora.com/product/tarte-mini-amazonian-clay-16-hour-full-coverage-foundation-P473843?skuId=2476216	tarte	57N Rich Neutral	16.0
Teint Idole Ultra Wear 5-In-1 Foundation Stick	Sephora	242	221	204	https://www.sephora.com/product/lancome-teint-idole-ultra-wear-5-in-1-foundation-stick-P468688?skuId=2423101	Lancôme	410 Bisque Warm	24.5
Synchro Skin Radiant Lifting Foundation SPF 30	Sephora	246	229	213	https://www.sephora.com/product/shiseido-synchro-skin-radiant-lifting-foundation-spf-30-P468401?skuId=2416345	Shiseido	150 Lace	47.0
Light Reflecting Advanced Skincare Foundation	Sephora	248	227	196	https://www.sephora.com/product/nars-light-reflecting-advance-skincare-foundation-P479338?skuId=2514461	NARS	Manaus	50.0
Even Better Clinical™ Serum Foundation Broad Spectrum SPF 25	Sephora	222	203	189	https://www.sephora.com/product/clinique-even-better-clinical-serum-foundation-broad-spectrum-spf-25-P468639?skuId=2422624	CLINIQUE	WN 122 Clove	44.0
Mini Luminous Silk Perfect Glow Flawless Oil-Free Foundation	Sephora	218	166	129	https://www.sephora.com/product/luminous-silk-foundation-mini-P425938?skuId=2492700	Armani Beauty	12	45.0
Triclone Skin Tech Medium Coverage Foundation with Fermented Arnica	Sephora	56	28	6	https://www.sephora.com/product/triclone-skin-tech-medium-coverage-foundation-with-fermented-arnica-P502185?skuId=2597011	HAUS LABS BY LADY GAGA	590 Deep Neutral	45.0
Dior Forever Skin Glow Foundation SPF 15	Sephora	242	218	184	https://www.sephora.com/product/forever-glow-foundation-P439941	Dior	5W Warm	55.0
Skin Foundation Stick	Sephora	231	201	175	https://www.sephora.com/product/foundation-stick-P270549?skuId=1809847	Bobbi Brown	Cool Walnut (C	52.0
Amazonian clay blurring powder foundation	Sephora	244	209	179	https://www.sephora.com/product/tarte-amazonian-clay-blurring-powder-foundation-P504215?skuId=2641314	tarte	18N Fair	39.0
Good Apple Full-Coverage Transfer-Proof Vegan Serum Foundation	Sephora	204	178	155	https://www.sephora.com/product/kvd-vegan-beauty-good-apple-full-coverage-transfer-proof-vegan-serum-foundation-P504366?skuId=2646388	KVD Beauty	Deep 094	42.0
Revealer Skin-Improving Foundation SPF 25 with Hyaluronic Acid and Niacinamide	Sephora	234	206	182	https://www.sephora.com/product/kosas-revealer-skin-improving-foundation-spf25-with-hyaluronic-acid-niacinamide-P481396?skuId=2512127	Kosas	Deep Neutral Warm 390	42.0
Mini Luminous Silk Perfect Glow Flawless Oil-Free Foundation	Sephora	218	166	129	https://www.sephora.com/product/luminous-silk-foundation-mini-P425938?skuId=2492593	Armani Beauty	11.75	45.0
Neo Nude Tinted Moisturizer with Hyaluronic Acid	Sephora	120	69	48	https://www.sephora.com/product/giorgio-armani-beauty-neo-nude-foundation-P458270?skuId=2355824	Armani Beauty	11.5	48.0
Bounce™ Liquid Whip Long Wear Foundation	Sephora	254	232	209	https://www.sephora.com/product/bounce-liquid-whip-longwear-foundation-P433987?skuId=2570943	beautyblender	3.25N Medium Neutral	29.0
Triple Fix Serum Foundation	Sephora	66	37	23	https://www.sephora.com/product/lys-beauty-triple-fix-serum-foundation-P468380?skuId=2435766	LYS Beauty	DPN4	24.0
Skin Long-Wear Weightless Foundation SPF 15	Sephora	233	193	167	https://www.sephora.com/product/skin-long-wear-weightless-foundation-spf-15-P427430?skuId=2032795	Bobbi Brown	Warm Ivory (W	52.0
Even Better™ Makeup Broad Spectrum SPF 15 Foundation	Sephora	251	244	236	https://www.sephora.com/product/even-better-makeup-spf-15-P234967?skuId=2083848	CLINIQUE	WN 96 Chai	34.0
Pure Radiant Tinted Moisturizer Broad Spectrum SPF 30	Sephora	114	67	41	https://www.sephora.com/product/pure-radiant-tinted-moisturizer-spf-30-pa-P302923?skuId=2456069	NARS	Auckland	46.0
Best Skin Ever Liquid Foundation	Sephora	244	224	200	https://www.sephora.com/product/sephora-collection-best-skin-ever-liquid-foundation-P467140?skuId=2326908	SEPHORA COLLECTION	25 N	20.0
Dior Forever Skin Glow Foundation SPF 15	Sephora	242	218	184	https://www.sephora.com/product/forever-glow-foundation-P439941	Dior	5W Warm	55.0
Teint Idole Ultra Wear 5-In-1 Foundation Stick	Sephora	242	221	204	https://www.sephora.com/product/lancome-teint-idole-ultra-wear-5-in-1-foundation-stick-P468688?skuId=2423127	Lancôme	460 Suede Warm	24.5
Prisme Libre Skin-Caring Matte Foundation	Sephora	230	191	158	https://www.sephora.com/product/givenchy-prisme-libre-skin-caring-matte-foundation-P481706?skuId=2509685	Givenchy	1	52.0
Sheer Glow Foundation	Sephora	175	133	111	https://www.sephora.com/product/sheer-glow-foundation-P247355?skuId=2165819	NARS	New Caledonia	47.0
Triple Fix Serum Foundation	Sephora	66	37	23	https://www.sephora.com/product/lys-beauty-triple-fix-serum-foundation-P468380?skuId=2435535	LYS Beauty	MN1	24.0
Mini Luminous Silk Perfect Glow Flawless Oil-Free Foundation	Sephora	218	166	129	https://www.sephora.com/product/luminous-silk-foundation-mini-P425938?skuId=2492569	Armani Beauty	6.25	45.0
Power Fabric + Longwear High Cover Foundation SPF 25	Sephora	114	62	38	https://www.sephora.com/product/power-fabric-longwear-high-cover-foundation-spf-25-P416785?skuId=2510444	Armani Beauty	5	69.0
Beyond Perfecting Foundation + Concealer	Sephora	246	233	217	https://www.sephora.com/product/beyond-perfecting-foundation-concealer-P393325?skuId=2166858	CLINIQUE	WN 01 Flax	37.0
Teint Idole Ultra 24H Long Wear Matte Foundation	Sephora	255	244	240	https://www.sephora.com/product/teint-idole-ultra-24h-long-wear-foundation-P308201?skuId=2169829	Lancôme	300 Bisque W	57.0
10 Hour Wear Perfection Foundation	Sephora	115	81	79	https://www.sephora.com/product/10-hr-wear-perfection-foundation-P379509?skuId=1751643	SEPHORA COLLECTION	8 Light Ivory (P)	20.0
Tinted Blur Foundation Stick	Sephora	148	120	106	https://www.sephora.com/product/nudies-tinted-blur-stick-P431758?skuId=2079408	NUDESTIX	Nude Light 3	32.0
Double Wear Stay-in-Place Matte Powder Foundation Refill	Sephora	238	196	171	https://www.sephora.com/product/estee-lauder-double-wear-stay-in-place-matte-powder-foundation-refill-P482263?skuId=2545044	Estée Lauder	3C2 Pebble	36.0
Skin Long-Wear Weightless Foundation SPF 15	Sephora	233	193	167	https://www.sephora.com/product/skin-long-wear-weightless-foundation-spf-15-P427430?skuId=2033025	Bobbi Brown	Warm Beige (W	52.0
Studio Skin 24 Hour Full Coverage Waterproof Foundation	Sephora	241	227	218	https://www.sephora.com/product/studio-skin-full-coverage-24-hour-foundation-P447363?skuId=2252054	Smashbox	cool	38.0
Beautiful Skin Medium Coverage Liquid Foundation with Hyaluronic Acid	Sephora	242	220	199	https://www.sephora.com/product/charlotte-tilbury-beautiful-skin-medium-coverage-liquid-foundation-with-hyaluronic-acid-P480286?skuId=2551943	Charlotte Tilbury	17 Neutral	49.0
Even Better™ Makeup Broad Spectrum SPF 15 Foundation	Sephora	251	244	236	https://www.sephora.com/product/even-better-makeup-spf-15-P234967?skuId=2083970	CLINIQUE	WN 48 Oat	34.0
True Skin Medium Coverage Serum Foundation with Niacinamide	Sephora	226	204	183	https://www.sephora.com/product/true-skin-serum-foundation-P429548?skuId=2527703	ILIA	Cres SF8.75	54.0
Traceless Foundation Stick	Sephora	90	69	64	https://www.sephora.com/product/traceless-foundation-stick-P422453?skuId=2046985	TOM FORD	2.7 Vellum	90.0
Studio Skin 24 Hour Full Coverage Waterproof Foundation	Sephora	241	227	218	https://www.sephora.com/product/studio-skin-full-coverage-24-hour-foundation-P447363?skuId=2252013	Smashbox	warm peach	38.0
Best Skin Ever Liquid Foundation	Sephora	244	224	200	https://www.sephora.com/product/sephora-collection-best-skin-ever-liquid-foundation-P467140?skuId=2326734	SEPHORA COLLECTION	50 N	20.0
Mini Pro Filt'r Soft Matte Foundation	Sephora	255	217	181	https://www.sephora.com/product/fenty-beauty-rihanna-mini-pro-filtr-soft-matte-foundation-P476525	Fenty Beauty by Rihanna	410	15.0
Mini Pro Filt'r Soft Matte Foundation	Sephora	255	217	181	https://www.sephora.com/product/fenty-beauty-rihanna-mini-pro-filtr-soft-matte-foundation-P476525	Fenty Beauty by Rihanna	410	15.0
Sheer Glow Foundation	Sephora	175	133	111	https://www.sephora.com/product/sheer-glow-foundation-P247355?skuId=2165835	NARS	Namibia	47.0
Triple Fix Serum Foundation	Sephora	66	37	23	https://www.sephora.com/product/lys-beauty-triple-fix-serum-foundation-P468380?skuId=2435576	LYS Beauty	MN5	24.0
Mini Pro Filt'r Soft Matte Foundation	Sephora	255	217	181	https://www.sephora.com/product/fenty-beauty-rihanna-mini-pro-filtr-soft-matte-foundation-P476525	Fenty Beauty by Rihanna	410	15.0
Even Better Clinical™ Serum Foundation Broad Spectrum SPF 25	Sephora	222	203	189	https://www.sephora.com/product/clinique-even-better-clinical-serum-foundation-broad-spectrum-spf-25-P468639?skuId=2422608	CLINIQUE	CN 78 Nutty	44.0
Traceless Foundation Stick	Sephora	90	69	64	https://www.sephora.com/product/traceless-foundation-stick-P422453?skuId=2183770	TOM FORD	1.1 Warm Sand	90.0
Mini Luminous Silk Perfect Glow Flawless Oil-Free Foundation	Sephora	218	166	129	https://www.sephora.com/product/luminous-silk-foundation-mini-P425938?skuId=2492577	Armani Beauty	8	45.0
Luminous Silk Perfect Glow Flawless Oil-Free Foundation	Sephora	233	202	173	https://www.sephora.com/product/luminous-silk-foundation-P393401	Armani Beauty	7.5	69.0
Dior Forever Matte Foundation SPF 15	Sephora	254	236	216	https://www.sephora.com/product/forever-matte-foundation-P439940?skuId=2508240	Dior	1W Warm	55.0
Traceless Soft Matte Foundation	Sephora	107	68	51	https://www.sephora.com/product/tom-ford-traceless-soft-matte-foundation-P459506?skuId=2367019	TOM FORD	1.5 Cream	90.0
Super Smoother Blurring Skin Tint	Sephora	234	199	179	https://www.sephora.com/product/iconic-london-super-smoother-blurring-skin-tint-P502623?skuId=2609204	Iconic London	Neutral Fair	32.0
Revealer Skin-Improving Foundation SPF 25 with Hyaluronic Acid and Niacinamide	Sephora	234	206	182	https://www.sephora.com/product/kosas-revealer-skin-improving-foundation-spf25-with-hyaluronic-acid-niacinamide-P481396?skuId=2512218	Kosas	Medium Deep Warm 300	42.0
Dior Forever Matte Foundation SPF 15	Sephora	254	236	216	https://www.sephora.com/product/forever-matte-foundation-P439940?skuId=2508513	Dior	8N Neutral	55.0
Double Wear Stay-in-Place Foundation	Sephora	148	113	85	https://www.sephora.com/product/double-wear-stay-in-place-makeup-P378284?skuId=1465244	Estée Lauder	5W1 Bronze Deep	48.0
CC+ Cream Oil-Free Matte with SPF 40	Sephora	204	173	142	https://www.sephora.com/product/your-skin-but-better-cc-oil-free-matte-with-spf-40-P433435?skuId=2088342	IT Cosmetics	Deep	44.0
Luminous Silk Perfect Glow Flawless Oil-Free Foundation	Sephora	233	202	173	https://www.sephora.com/product/luminous-silk-foundation-P393401	Armani Beauty	7.5	69.0
Pro Filt’r Soft Matte Longwear Powder Foundation	Sephora	250	230	223	https://www.sephora.com/product/fenty-beauty-rihanna-pro-filt-r-soft-matte-powder-foundation-P466829?skuId=2413813	Fenty Beauty by Rihanna	490	40.0
Pro Filt’r Soft Matte Longwear Liquid Foundation	Sephora	251	228	187	https://www.sephora.com/product/pro-filtr-soft-matte-longwear-foundation-P87985432?skuId=2484327	Fenty Beauty by Rihanna	440	15.0
Double Wear Stay-in-Place Matte Powder Foundation Refill	Sephora	238	196	171	https://www.sephora.com/product/estee-lauder-double-wear-stay-in-place-matte-powder-foundation-refill-P482263?skuId=2544955	Estée Lauder	1N2 Ecru	36.0
Luminous Silk Perfect Glow Flawless Oil-Free Foundation	Sephora	233	202	173	https://www.sephora.com/product/luminous-silk-foundation-P393401	Armani Beauty	7.5	69.0
Luminous Silk Perfect Glow Flawless Oil-Free Foundation	Sephora	233	202	173	https://www.sephora.com/product/luminous-silk-foundation-P393401	Armani Beauty	7.5	69.0
Revealer Skin-Improving Foundation SPF 25 with Hyaluronic Acid and Niacinamide	Sephora	234	206	182	https://www.sephora.com/product/kosas-revealer-skin-improving-foundation-spf25-with-hyaluronic-acid-niacinamide-P481396?skuId=2512259	Kosas	Medium Tan Neutral Olive 260	42.0
Intensive Serum Foundation SPF 40	Sephora	73	36	18	https://www.sephora.com/product/bobbi-brown-intensive-skin-serum-foundation-spf-40-P465745?skuId=2501427	Bobbi Brown	Porcelain	75.0
Airbrush Flawless Longwear Foundation	Sephora	246	227	212	https://www.sephora.com/product/airbrush-flawless-longwear-foundation-P448869?skuId=2245025	Charlotte Tilbury	15 Warm	49.0
Luminous Silk Perfect Glow Flawless Oil-Free Foundation	Sephora	233	202	173	https://www.sephora.com/product/luminous-silk-foundation-P393401	Armani Beauty	7.5	69.0
Tinted Moisturizer Oil Free Natural Skin Perfector Broad Spectrum SPF 20	Sephora	255	206	174	https://www.sephora.com/product/tinted-moisturizer-broad-spectrum-oil-free-P140906?skuId=2454452	Laura Mercier	3W1 Bisque	29.0
Conseal The Deal Long-Wear Full-Coverage Foundation	Sephora	243	213	189	https://www.sephora.com/product/lawless-conseal-deal-long-wear-full-coverage-foundation-P475128?skuId=2531242	LAWLESS	Golden	39.0
Studio Skin 24 Hour Full Coverage Waterproof Foundation	Sephora	241	227	218	https://www.sephora.com/product/studio-skin-full-coverage-24-hour-foundation-P447363?skuId=2251981	Smashbox	warm peach	38.0
Turn Up The Base Versatile Powder Foundation	Sephora	97	78	61	https://www.sephora.com/product/one-size-by-patrick-starrr-turn-up-base-versatile-powder-foundation-P469953?skuId=2427029	ONE/SIZE by Patrick Starrr	Dark 3 (R)	38.0
