The Minimalist Perfecting Complexion Foundation and Concealer Stick	Sephora	80	31	16	https://www.sephora.com/product/merit-the-minimalist-perfecting-complexion-foundation-concealer-stick-P468694?skuId=2569085	MERIT	Buff	38.0
Matte Perfection Powder Foundation	Sephora	228	199	185	https://www.sephora.com/product/matte-perfection-powder-foundation-P408606?skuId=1787639	SEPHORA COLLECTION	14 Neutral Linen	20.0
Skin Foundation SPF 15	Sephora	248	221	204	https://www.sephora.com/product/skin-foundation-spf-15-P270551?skuId=1288794	Bobbi Brown	Warm Beige 3.5	52.0
Natural Radiant Longwear Foundation	Sephora	255	224	209	https://www.sephora.com/product/natural-radiant-longwear-foundation-P427301?skuId=2030955	NARS	Yukon	50.0
Vision Cream Cover Adjustable Foundation & Concealer	Sephora	206	180	155	https://www.sephora.com/product/danessa-myricks-vision-cream-cover-2-in-1-foundation-concealer-P469460?skuId=2443919	Danessa Myricks Beauty	W02	22.0
Super Smoother Blurring Skin Tint	Sephora	234	199	179	https://www.sephora.com/product/iconic-london-super-smoother-blurring-skin-tint-P502623?skuId=2609147	Iconic London	Neutral Medium	32.0
Natural Radiant Longwear Foundation	Sephora	255	224	209	https://www.sephora.com/product/natural-radiant-longwear-foundation-P427301?skuId=2031144	NARS	Huahine	50.0
Luminous Silk Perfect Glow Flawless Oil-Free Foundation	Sephora	233	202	173	https://www.sephora.com/product/luminous-silk-foundation-P393401	Armani Beauty	7.5	69.0
Original Loose Powder Mineral Foundation SPF 15	Sephora	199	171	147	https://www.sephora.com/product/bareminerals-original-foundation-broad-spectrum-spf-15-P61003?skuId=1922525	bareMinerals	Neutral Dark 24	38.0
Synchro Skin Self-Refreshing Foundation SPF 30	Sephora	250	229	200	https://www.sephora.com/product/synchro-skin-self-refreshing-foundation-spf-30-P449106?skuId=2248565	Shiseido	230	47.0
Your Skin But Better Foundation + Skincare	Sephora	194	141	97	https://www.sephora.com/product/it-cosmetics-your-skin-but-better-foundation-skincare-P461600?skuId=2379899	IT Cosmetics	Rich Cool 50	44.0
Luminous Silk Perfect Glow Flawless Oil-Free Foundation	Sephora	233	202	173	https://www.sephora.com/product/luminous-silk-foundation-P393401	Armani Beauty	7.5	69.0
#FauxFilter Skin Finish Buildable Coverage Foundation Stick	Sephora	255	224	204	https://www.sephora.com/product/huda-beauty-fauxfilter-skin-finish-buildable-coverage-foundation-stick-P465324	HUDA BEAUTY	300N Latte	39.0
BAREPRO 16-HR Skin-Perfecting Powder Foundation	Sephora	210	162	126	https://www.sephora.com/product/barepro-longwear-powder-foundation-P410543?skuId=2516771	bareMinerals	Fair 17 Neutral	38.0
Triclone Skin Tech Medium Coverage Foundation with Fermented Arnica	Sephora	56	28	6	https://www.sephora.com/product/triclone-skin-tech-medium-coverage-foundation-with-fermented-arnica-P502185?skuId=2597060	HAUS LABS BY LADY GAGA	530 Deep Neutral	45.0
Essential High Coverage Crème Foundation	Sephora	235	216	209	https://www.sephora.com/product/essential-high-coverage-creme-foundation-P434015?skuId=2125086	Jouer Cosmetics	Alabaster	38.0
Stay Naked Weightless Foundation	Sephora	221	170	149	https://www.sephora.com/product/stay-naked-weightless-foundation-P447143?skuId=2247310	Urban Decay	90WR	10.0
Sublime Perfection Foundation	Sephora	255	237	225	https://www.sephora.com/product/skin-fetish-sublime-perfection-foundation-P447519?skuId=2257178	PAT McGRATH LABS	Deep 31	68.0
Éternité De Beauté 24 Hour Full Coverage Luminous Matte Finish Foundation	Sephora	237	205	184	https://www.sephora.com/product/gucci-fluide-de-beaute-fini-naturel-natural-finish-fluid-foundation-P467622?skuId=2638781	Gucci	360W	69.0
Pro Filt’r Soft Matte Longwear Powder Foundation	Sephora	250	230	223	https://www.sephora.com/product/fenty-beauty-rihanna-pro-filt-r-soft-matte-powder-foundation-P466829?skuId=2413375	Fenty Beauty by Rihanna	120	40.0
#FauxFilter Luminous Matte Foundation	Sephora	245	230	225	https://www.sephora.com/product/huda-beauty-faux-filter-luminous-matte-foundation-P467625?skuId=2425593	HUDA BEAUTY	540G Chocolate Truffle	42.0
Essential High Coverage Crème Foundation	Sephora	235	216	209	https://www.sephora.com/product/essential-high-coverage-creme-foundation-P434015?skuId=2124873	Jouer Cosmetics	Espresso	38.0
#FauxFilter Skin Finish Buildable Coverage Foundation Stick	Sephora	255	224	204	https://www.sephora.com/product/huda-beauty-fauxfilter-skin-finish-buildable-coverage-foundation-stick-P465324	HUDA BEAUTY	300N Latte	39.0
NU BARE LOOK TINT Hydrating Skin Tint Foundation with Hyaluronic Acid	Sephora	252	214	165	https://www.sephora.com/product/yves-saint-laurent-nu-bare-look-skin-tint-foundation-P474600?skuId=2489250	Yves Saint Laurent	15	44.0
Matte Perfection Powder Foundation	Sephora	228	199	185	https://www.sephora.com/product/matte-perfection-powder-foundation-P408606?skuId=1787795	SEPHORA COLLECTION	46 Almond Peach	20.0
Futurist Hydra Rescue Moisturizing Foundation SPF 45	Sephora	123	89	79	https://www.sephora.com/product/estee-lauder-futurist-hydrating-rescue-moisturizing-foundation-spf-45-P454063?skuId=2324432	Estée Lauder	4N1 Shell Beige	50.0
Yummy Skin Serum Foundation Refill	Sephora	255	231	207	https://www.sephora.com/product/danessa-myricks-beauty-yummy-skin-serum-foundation-refill-P481695?skuId=2575918	Danessa Myricks Beauty	26N	24.0
True Skin Medium Coverage Serum Foundation with Niacinamide	Sephora	226	204	183	https://www.sephora.com/product/true-skin-serum-foundation-P429548?skuId=2527653	ILIA	Chios SF6	54.0
Eaze Drop Blurring Skin Tint	Sephora	250	226	214	https://www.sephora.com/product/fenty-beauty-rihanna-eaze-drop-blurring-skin-tint-P470025?skuId=2432003	Fenty Beauty by Rihanna	25	35.0
Tinted Face Oil Comfy Skin Tint	Sephora	243	184	140	https://www.sephora.com/product/tinted-face-oil-P441884?skuId=2193621	Kosas	Tone 08	42.0
Essential High Coverage Crème Foundation	Sephora	235	216	209	https://www.sephora.com/product/essential-high-coverage-creme-foundation-P434015?skuId=2124758	Jouer Cosmetics	Praline	38.0
Maracuja Hydrating Tinted Moisturizer	Sephora	175	122	88	https://www.sephora.com/product/tarte-maracuja-tinted-hydrator-P456371?skuId=2343465	tarte	22S light sand	30.0
Ambient Soft Glow Foundation	Sephora	224	206	192	https://www.sephora.com/product/ambient-soft-glow-foundation-P501154?skuId=2587038	Hourglass	15.5	58.0
Synchro Skin Self-Refreshing Foundation SPF 30	Sephora	250	229	200	https://www.sephora.com/product/synchro-skin-self-refreshing-foundation-spf-30-P449106?skuId=2248722	Shiseido	510	47.0
Pro Filt'r Hydrating Longwear Foundation	Sephora	255	224	177	https://www.sephora.com/product/pro-filt-r-hydrating-longwear-foundation-P448702?skuId=2267979	Fenty Beauty by Rihanna	140	13.0
Ambient Soft Glow Foundation	Sephora	224	206	192	https://www.sephora.com/product/ambient-soft-glow-foundation-P501154?skuId=2586857	Hourglass	6.5	58.0
Maracuja Hydrating Tinted Moisturizer	Sephora	175	122	88	https://www.sephora.com/product/tarte-maracuja-tinted-hydrator-P456371?skuId=2343523	tarte	36H medium	30.0
Pro Filt’r Soft Matte Longwear Powder Foundation	Sephora	250	230	223	https://www.sephora.com/product/fenty-beauty-rihanna-pro-filt-r-soft-matte-powder-foundation-P466829?skuId=2413383	Fenty Beauty by Rihanna	130	40.0
Vanish™ Seamless Finish Foundation Stick	Sephora	246	222	212	https://www.sephora.com/product/vanish-seamless-finish-foundation-stick-P410532?skuId=1827435	Hourglass	17.5 Espresso	49.0
Even Better™ Makeup Broad Spectrum SPF 15 Foundation	Sephora	251	244	236	https://www.sephora.com/product/even-better-makeup-spf-15-P234967?skuId=1332188	CLINIQUE	CN 78 Nutty	34.0
Sheer Glow Foundation	Sephora	175	133	111	https://www.sephora.com/product/sheer-glow-foundation-P247355?skuId=2170637	NARS	Pampelune	47.0
GloWish Multidew Vegan Skin Tint Foundation	Sephora	253	225	213	https://www.sephora.com/product/huda-beauty-glowish-multidew-vegan-skin-tint-foundation-P472815?skuId=2465383	HUDA BEAUTY	03 Light	37.0
SEA Hydroflex™ Serum Foundation	Sephora	249	222	211	https://www.sephora.com/product/tarte-sea-hydroflex-trade-serum-foundation-P473000?skuId=2453702	tarte	25H light	19.0
Beautiful Skin Medium Coverage Liquid Foundation with Hyaluronic Acid	Sephora	242	220	199	https://www.sephora.com/product/charlotte-tilbury-beautiful-skin-medium-coverage-liquid-foundation-with-hyaluronic-acid-P480286?skuId=2551935	Charlotte Tilbury	9 Warm	49.0
Synchro Skin Self-Refreshing Tint SPF 20	Sephora	219	179	153	https://www.sephora.com/product/shiseido-synchro-skin-self-refreshing-tint-spf-20-P480353?skuId=2516169	Shiseido	125 Fair Asterid	43.0
Turn Up The Base Versatile Powder Foundation	Sephora	97	78	61	https://www.sephora.com/product/one-size-by-patrick-starrr-turn-up-base-versatile-powder-foundation-P469953?skuId=2426989	ONE/SIZE by Patrick Starrr	Medium Dark 5 (R)	38.0
Amazonian Clay 16-Hour Full Coverage Foundation	Sephora	239	221	199	https://www.sephora.com/product/tarte-amazonian-clay-16-hour-full-coverage-foundation-P473821?skuId=2475762	tarte	18B Fair	40.0
Studio Skin 24 Hour Full Coverage Waterproof Foundation	Sephora	241	227	218	https://www.sephora.com/product/studio-skin-full-coverage-24-hour-foundation-P447363?skuId=2251973	Smashbox	neutral	38.0
Aqua Foundation	Sephora	236	196	171	https://www.sephora.com/product/aqua-foundation-P431509?skuId=2082618	Koh Gen Do	123	96.0
The Soft Fluid Long Wear Foundation SPF 20	Sephora	255	215	193	https://www.sephora.com/product/the-soft-fluid-long-wear-foundation-spf-20-P423742?skuId=1999887	La Mer	110 Shell	140.0
Positive Light Tinted Moisturizer Broad Spectrum SPF 20 Sunscreen	Sephora	247	213	185	https://www.sephora.com/product/rare-beauty-by-selena-gomez-positive-light-tinted-moisturizer-broad-spectrum-spf-20-sunscreen-P482729?skuId=2557072	Rare Beauty by Selena Gomez	20W	30.0
10 Hour Wear Perfection Foundation	Sephora	115	81	79	https://www.sephora.com/product/10-hr-wear-perfection-foundation-P379509?skuId=2222248	SEPHORA COLLECTION	59 Mahogany	20.0
Born This Way Natural Finish Longwear Liquid Foundation	Sephora	248	216	195	https://www.sephora.com/product/born-this-way-P397517?skuId=1711944	Too Faced	Nude	45.0
Light Reflecting Advanced Skincare Foundation	Sephora	248	227	196	https://www.sephora.com/product/nars-light-reflecting-advance-skincare-foundation-P479338?skuId=2514560	NARS	Aruba	50.0
Halo Healthy Glow Tinted Moisturizer Broad Spectrum SPF 25 with Hyaluronic Acid	Sephora	129	80	50	https://www.sephora.com/product/smashbox-halo-healthy-glow-tinted-moisturizer-broad-spectrum-spf-25-P460019?skuId=2376671	Smashbox	Tan Dark	41.0
Double Wear Stay-in-Place Foundation	Sephora	148	113	85	https://www.sephora.com/product/double-wear-stay-in-place-makeup-P378284?skuId=1465277	Estée Lauder	1W2 Sand	48.0
Triple Fix Serum Foundation	Sephora	66	37	23	https://www.sephora.com/product/lys-beauty-triple-fix-serum-foundation-P468380?skuId=2435600	LYS Beauty	TN3	24.0
Maracuja Juicy Glow Skin Tint	Sephora	247	208	167	https://www.sephora.com/product/tarte-maracuja-juicy-foundation-P505127?skuId=2642189	tarte	61N Espresso Neutral	40.0
True Skin Medium Coverage Serum Foundation with Niacinamide	Sephora	226	204	183	https://www.sephora.com/product/true-skin-serum-foundation-P429548?skuId=2527802	ILIA	Flores SF13.5	54.0
Tinted Moisturizer Oil Free Natural Skin Perfector Broad Spectrum SPF 20	Sephora	255	206	174	https://www.sephora.com/product/tinted-moisturizer-broad-spectrum-oil-free-P140906?skuId=2449379	Laura Mercier	6N1 Mocha	53.0
SEA Hydroflex™ Serum Foundation	Sephora	249	222	211	https://www.sephora.com/product/tarte-sea-hydroflex-trade-serum-foundation-P473000?skuId=2453611	tarte	12B fair beige	19.0
Luminous Foundation	Sephora	224	208	193	https://www.sephora.com/product/luminous-foundation-P449124?skuId=2270619	Anastasia Beverly Hills	110C	38.0
Luminous Silk Perfect Glow Flawless Oil-Free Foundation	Sephora	233	202	173	https://www.sephora.com/product/luminous-silk-foundation-P393401	Armani Beauty	7.5	69.0
#FauxFilter Skin Finish Buildable Coverage Foundation Stick	Sephora	255	224	204	https://www.sephora.com/product/huda-beauty-fauxfilter-skin-finish-buildable-coverage-foundation-stick-P465324	HUDA BEAUTY	300N Latte	39.0
Sheer Glow Foundation	Sephora	175	133	111	https://www.sephora.com/product/sheer-glow-foundation-P247355?skuId=2165736	NARS	Valencia	47.0
Even Better Clinical™ Serum Foundation Broad Spectrum SPF 25	Sephora	222	203	189	https://www.sephora.com/product/clinique-even-better-clinical-serum-foundation-broad-spectrum-spf-25-P468639?skuId=2422723	CLINIQUE	CN 126 Espresso	44.0
Sunshine Skin Tint Clean SPF 30 Foundation	Sephora	242	206	184	https://www.sephora.com/product/sunshine-skin-tint-spf-30-P410176?skuId=2414258	MILK MAKEUP	Medium	42.0
Mini Tinted Moisturizer Oil Free Natural Skin Perfector Broad Spectrum SPF 20	Sephora	255	206	174	https://www.sephora.com/product/laura-mercier-mini-tinted-moisturizer-broad-spectrum-spf-20-oil-free-P466665?skuId=2454437	Laura Mercier	3C1 Fawn	29.0
#FauxFilter Luminous Matte Foundation	Sephora	245	230	225	https://www.sephora.com/product/huda-beauty-faux-filter-luminous-matte-foundation-P467625?skuId=2425403	HUDA BEAUTY	310G Amaretti	42.0
#FauxFilter Skin Finish Buildable Coverage Foundation Stick	Sephora	255	224	204	https://www.sephora.com/product/huda-beauty-fauxfilter-skin-finish-buildable-coverage-foundation-stick-P465324	HUDA BEAUTY	300N Latte	39.0
Original Loose Powder Mineral Foundation SPF 15	Sephora	199	171	147	https://www.sephora.com/product/bareminerals-original-foundation-broad-spectrum-spf-15-P61003?skuId=1922558	bareMinerals	Neutral Ivory 06	38.0
Tinted Cover Skin Tint Foundation	Sephora	244	187	160	https://www.sephora.com/product/nudies-tinted-cover-foundation-P448152?skuId=2661460	NUDESTIX	NUDE 1	36.0
Luminous Silk Perfect Glow Flawless Oil-Free Foundation	Sephora	233	202	173	https://www.sephora.com/product/luminous-silk-foundation-P393401	Armani Beauty	7.5	69.0
Good Apple Full-Coverage Transfer-Proof Vegan Serum Foundation	Sephora	204	178	155	https://www.sephora.com/product/kvd-vegan-beauty-good-apple-full-coverage-transfer-proof-vegan-serum-foundation-P504366?skuId=2646115	KVD Beauty	Medium 027	42.0
10 Hour Wear Perfection Foundation	Sephora	115	81	79	https://www.sephora.com/product/10-hr-wear-perfection-foundation-P379509?skuId=2225795	SEPHORA COLLECTION	19.5 Pink Cream	20.0
Stay-Matte Oil-Free Makeup Foundation	Sephora	237	208	190	https://www.sephora.com/product/stay-matte-oil-free-makeup-P310726?skuId=1411214	CLINIQUE	21 Cream Caramel	34.0
SurrealSkin™ Liquid Foundation	Sephora	236	199	170	https://www.sephora.com/product/makeup-by-mario-surreal-foundation-P503679?skuId=2620292	MAKEUP BY MARIO	7C	42.0
Pure Radiant Tinted Moisturizer Broad Spectrum SPF 30	Sephora	114	67	41	https://www.sephora.com/product/pure-radiant-tinted-moisturizer-spf-30-pa-P302923?skuId=1478452	NARS	Terre Neuve	46.0
Positive Light Tinted Moisturizer Broad Spectrum SPF 20 Sunscreen	Sephora	247	213	185	https://www.sephora.com/product/rare-beauty-by-selena-gomez-positive-light-tinted-moisturizer-broad-spectrum-spf-20-sunscreen-P482729?skuId=2557171	Rare Beauty by Selena Gomez	30N	30.0
Pro Filt’r Soft Matte Longwear Liquid Foundation	Sephora	251	228	187	https://www.sephora.com/product/pro-filtr-soft-matte-longwear-foundation-P87985432?skuId=1925270	Fenty Beauty by Rihanna	250	40.0
Conseal The Deal Long-Wear Full-Coverage Foundation	Sephora	243	213	189	https://www.sephora.com/product/lawless-conseal-deal-long-wear-full-coverage-foundation-P475128?skuId=2531150	LAWLESS	Sienna	39.0
Best Skin Ever Liquid Foundation	Sephora	244	224	200	https://www.sephora.com/product/sephora-collection-best-skin-ever-liquid-foundation-P467140?skuId=2327047	SEPHORA COLLECTION	66.5 N	20.0
Good Apple Lightweight Full-Coverage Cream Foundation Balm	Sephora	209	181	159	https://www.sephora.com/product/kvd-vegan-beauty-good-apple-skin-perfecting-foundation-balm-P469488?skuId=2420156	KVD Beauty	Deep 088	42.5
Good Apple Full-Coverage Transfer-Proof Vegan Serum Foundation	Sephora	204	178	155	https://www.sephora.com/product/kvd-vegan-beauty-good-apple-full-coverage-transfer-proof-vegan-serum-foundation-P504366?skuId=2646263	KVD Beauty	Tan 070	42.0
The Minimalist Perfecting Complexion Foundation and Concealer Stick	Sephora	80	31	16	https://www.sephora.com/product/merit-the-minimalist-perfecting-complexion-foundation-concealer-stick-P468694?skuId=2569127	MERIT	Tiger Eye	38.0
Skin Enhancing Duo: Luminous Skin Tint Serum Foundation & Foundation Brush	Sephora	220	183	165	https://www.sephora.com/product/rose-inc-skin-enhancing-duo-luminous-skint-tint-foundation-brush-P481146?skuId=2566693	ROSE INC	40	59.0
Born This Way Matte Longwear Liquid Foundation	Sephora	250	231	216	https://www.sephora.com/product/too-faced-born-this-way-matte-24-hour-foundation-P458586?skuId=2360147	Too Faced	Porcelain	45.0
Pro Filt’r Soft Matte Longwear Liquid Foundation	Sephora	251	228	187	https://www.sephora.com/product/pro-filtr-soft-matte-longwear-foundation-P87985432?skuId=2484194	Fenty Beauty by Rihanna	330	15.0
Luminous Silk Perfect Glow Flawless Oil-Free Foundation	Sephora	233	202	173	https://www.sephora.com/product/luminous-silk-foundation-P393401	Armani Beauty	7.5	69.0
Reboot Active Care Revitalizing Foundation	Sephora	226	194	169	https://www.sephora.com/product/make-up-for-ever-reboot-foundation-P454035?skuId=2308369	MAKE UP FOR EVER	Y255	42.0
10 Hour Wear Perfection Foundation	Sephora	115	81	79	https://www.sephora.com/product/10-hr-wear-perfection-foundation-P379509?skuId=1492909	SEPHORA COLLECTION	55 Deep Cocoa (N)	20.0
Smooth Finish Foundation Powder	Sephora	254	205	147	https://www.sephora.com/product/smooth-finish-foundation-powder-P381714?skuId=1530476	Laura Mercier	2	52.0
Original Loose Powder Mineral Foundation SPF 15	Sephora	199	171	147	https://www.sephora.com/product/bareminerals-original-foundation-broad-spectrum-spf-15-P61003?skuId=1229020	bareMinerals	Warm Dark 26	38.0
Soft Matte Complete Foundation	Sephora	83	48	28	https://www.sephora.com/product/nars-soft-matte-complete-foundation-P462720?skuId=2374494	NARS	Barcelona	42.0
Mini Luminous Silk Perfect Glow Flawless Oil-Free Foundation	Sephora	218	166	129	https://www.sephora.com/product/luminous-silk-foundation-mini-P425938?skuId=2492635	Armani Beauty	3.8	45.0
Revealer Skin-Improving Foundation SPF 25 with Hyaluronic Acid and Niacinamide	Sephora	234	206	182	https://www.sephora.com/product/kosas-revealer-skin-improving-foundation-spf25-with-hyaluronic-acid-niacinamide-P481396?skuId=2512119	Kosas	Deep Neutral Olive 400	42.0
Real Flawless Weightless Perfecting Foundation	Sephora	240	212	190	https://www.sephora.com/product/laura-mercier-real-flawless-weightless-perfecting-foundation-P504012?skuId=2642817	Laura Mercier	2C2 Soft Sand	48.0
Luminous Silk Perfect Glow Flawless Oil-Free Foundation	Sephora	233	202	173	https://www.sephora.com/product/luminous-silk-foundation-P393401	Armani Beauty	7.5	69.0
BB blur tinted moisturizer Broad Spectrum SPF 30 Sunscreen	Sephora	239	206	187	https://www.sephora.com/product/bb-tinted-treatment-12-hour-primer-broad-spectrum-spf-30-sunscreen-P377542?skuId=2641520	tarte	Light	40.0
Turn Up The Base Versatile Powder Foundation	Sephora	97	78	61	https://www.sephora.com/product/one-size-by-patrick-starrr-turn-up-base-versatile-powder-foundation-P469953?skuId=2426997	ONE/SIZE by Patrick Starrr	Medium Dark 6 (GO)	38.0
Sublime Perfection Foundation	Sephora	255	237	225	https://www.sephora.com/product/skin-fetish-sublime-perfection-foundation-P447519?skuId=2256923	PAT McGRATH LABS	Light 6	68.0
Essential High Coverage Crème Foundation	Sephora	235	216	209	https://www.sephora.com/product/essential-high-coverage-creme-foundation-P434015?skuId=2124915	Jouer Cosmetics	Golden Sand	38.0
Turn Up The Base Versatile Powder Foundation	Sephora	97	78	61	https://www.sephora.com/product/one-size-by-patrick-starrr-turn-up-base-versatile-powder-foundation-P469953?skuId=2427003	ONE/SIZE by Patrick Starrr	Dark 1 (GO)	38.0
Best Skin Ever Liquid Foundation	Sephora	244	224	200	https://www.sephora.com/product/sephora-collection-best-skin-ever-liquid-foundation-P467140?skuId=2326874	SEPHORA COLLECTION	15.5 N	20.0
Traceless Foundation Stick	Sephora	90	69	64	https://www.sephora.com/product/traceless-foundation-stick-P422453?skuId=1990423	TOM FORD	9.5 Warm Almond	90.0
Turn Up the Base Blurring Foundation	Sephora	247	224	210	https://www.sephora.com/product/turn-up-base-beauty-blur-balm-foundation-P478536?skuId=2548154	ONE/SIZE by Patrick Starrr	Light 1	35.0
10 Hour Wear Perfection Foundation	Sephora	115	81	79	https://www.sephora.com/product/10-hr-wear-perfection-foundation-P379509?skuId=1492875	SEPHORA COLLECTION	12 Light Ecru (N)	20.0
HD Skin Undetectable Longwear Foundation	Sephora	241	216	196	https://www.sephora.com/product/make-up-for-ever-hd-skin-foundation-P479712?skuId=2514156	MAKE UP FOR EVER	2Y20 Warm Nude	45.0
Real Flawless Weightless Perfecting Foundation	Sephora	240	212	190	https://www.sephora.com/product/laura-mercier-real-flawless-weightless-perfecting-foundation-P504012?skuId=2642965	Laura Mercier	5C1 Sepia	48.0
SEA Hydroflex™ Serum Foundation	Sephora	249	222	211	https://www.sephora.com/product/tarte-sea-hydroflex-trade-serum-foundation-P473000?skuId=2453819	tarte	46S tan	19.0
Revealer Skin-Improving Foundation SPF 25 with Hyaluronic Acid and Niacinamide	Sephora	234	206	182	https://www.sephora.com/product/kosas-revealer-skin-improving-foundation-spf25-with-hyaluronic-acid-niacinamide-P481396?skuId=2512408	Kosas	Very Light Neutral 110	42.0
Prisme Libre Skin-Caring Glow Foundation	Sephora	249	212	186	https://www.sephora.com/product/givenchy-prisme-libre-skin-caring-glow-foundation-P469469?skuId=2430551	Givenchy	5	52.0
CC+ Cream Full Coverage Color Correcting Foundation with SPF 50+	Sephora	255	242	234	https://www.sephora.com/product/your-skin-but-better-cc-cream-spf-50-P411885?skuId=1954759	IT Cosmetics	Rich	44.0
Mini Pro Filt'r Soft Matte Foundation	Sephora	255	217	181	https://www.sephora.com/product/fenty-beauty-rihanna-mini-pro-filtr-soft-matte-foundation-P476525	Fenty Beauty by Rihanna	410	15.0
SurrealSkin™ Liquid Foundation	Sephora	236	199	170	https://www.sephora.com/product/makeup-by-mario-surreal-foundation-P503679?skuId=2620342	MAKEUP BY MARIO	12O	42.0
Tinted Blur Foundation Stick	Sephora	148	120	106	https://www.sephora.com/product/nudies-tinted-blur-stick-P431758?skuId=2079424	NUDESTIX	Nude Medium 5	32.0
Vital Pressed Skincare Blurring Talc-Free Setting Powder	Sephora	238	238	238	https://www.sephora.com/product/vital-pressed-skincare-blurring-talc-free-setting-powder-P500303?skuId=2570398	Westman Atelier	Dune	75.0
Tinted Cover Skin Tint Foundation	Sephora	244	187	160	https://www.sephora.com/product/nudies-tinted-cover-foundation-P448152?skuId=2661478	NUDESTIX	NUDE 1.5	36.0
Skin Foundation Stick	Sephora	231	201	175	https://www.sephora.com/product/foundation-stick-P270549?skuId=1587559	Bobbi Brown	Sand (N	52.0
Skin Long-Wear Fluid Powder Foundation SPF 20	Sephora	221	173	137	https://www.sephora.com/product/bobbi-brown-skin-long-wear-fluid-powder-foundation-P455195?skuId=2307247	Bobbi Brown	Walnut	40.0
Pro Filt’r Soft Matte Longwear Liquid Foundation	Sephora	251	228	187	https://www.sephora.com/product/pro-filtr-soft-matte-longwear-foundation-P87985432?skuId=1925429	Fenty Beauty by Rihanna	400	40.0
Eaze Drop Blurring Skin Tint	Sephora	250	226	214	https://www.sephora.com/product/fenty-beauty-rihanna-eaze-drop-blurring-skin-tint-P470025?skuId=2431831	Fenty Beauty by Rihanna	8	35.0
Halo Healthy Glow Tinted Moisturizer Broad Spectrum SPF 25 with Hyaluronic Acid	Sephora	129	80	50	https://www.sephora.com/product/smashbox-halo-healthy-glow-tinted-moisturizer-broad-spectrum-spf-25-P460019?skuId=2376598	Smashbox	Fair	41.0
Triple Fix Serum Foundation	Sephora	66	37	23	https://www.sephora.com/product/lys-beauty-triple-fix-serum-foundation-P468380?skuId=2435626	LYS Beauty	TG5	24.0
Prisme Libre Skin-Caring Matte Foundation	Sephora	230	191	158	https://www.sephora.com/product/givenchy-prisme-libre-skin-caring-matte-foundation-P481706?skuId=2509800	Givenchy	3	52.0
Major Skin Crème Foundation and Finishing Powder Duo	Sephora	247	240	232	https://www.sephora.com/product/major-skin-creme-powder-foundation-duo-P502039?skuId=2607380	PATRICK TA	Medium 3	52.0
Best Skin Ever Liquid Foundation	Sephora	244	224	200	https://www.sephora.com/product/sephora-collection-best-skin-ever-liquid-foundation-P467140?skuId=2326932	SEPHORA COLLECTION	14 P	20.0
Teint Idole Ultra 24H Long Wear Matte Foundation	Sephora	255	244	240	https://www.sephora.com/product/teint-idole-ultra-24h-long-wear-foundation-P308201?skuId=1397884	Lancôme	350 Bisque C	57.0
#FauxFilter Skin Finish Buildable Coverage Foundation Stick	Sephora	255	224	204	https://www.sephora.com/product/huda-beauty-fauxfilter-skin-finish-buildable-coverage-foundation-stick-P465324	HUDA BEAUTY	300N Latte	39.0
Sublime Perfection Foundation	Sephora	255	237	225	https://www.sephora.com/product/skin-fetish-sublime-perfection-foundation-P447519?skuId=2256980	PAT McGRATH LABS	Light Medium 12	68.0
Éternité De Beauté 24 Hour Full Coverage Luminous Matte Finish Foundation	Sephora	237	205	184	https://www.sephora.com/product/gucci-fluide-de-beaute-fini-naturel-natural-finish-fluid-foundation-P467622?skuId=2666741	Gucci	540N	69.0
Liquid Touch Weightless Foundation	Sephora	247	223	197	https://www.sephora.com/product/rare-beauty-by-selena-gomez-liquid-touch-weightless-foundation-P49848448	Rare Beauty by Selena Gomez	360W	30.0
Dreamskin Fresh & Perfect Cushion Broad Spectrum SPF 50	Sephora	246	196	163	https://www.sephora.com/product/capture-dreamskin-fresh-perfect-cushion-broad-spectrum-spf-50-P435806?skuId=2145373	Dior	030 Medium Beige	90.0
Positive Light Tinted Moisturizer Broad Spectrum SPF 20 Sunscreen	Sephora	247	213	185	https://www.sephora.com/product/rare-beauty-by-selena-gomez-positive-light-tinted-moisturizer-broad-spectrum-spf-20-sunscreen-P482729?skuId=2557197	Rare Beauty by Selena Gomez	32N	30.0
